{
  "$schema": "https://json-schema.org/draft/2020-12/schema",
  "title": "Document",
  "description": "The canonical v1 document stored as `document.json`.",
  "type": "object",
  "properties": {
    "noteId": {
      "type": "string",
      "pattern": "^[0-9a-f]{8}-[0-9a-f]{4}-4[0-9a-f]{3}-[89ab][0-9a-f]{3}-[0-9a-f]{12}$"
    },
    "organization": {
      "$ref": "#/$defs/Organization"
    },
    "schemaVersion": {
      "type": "integer",
      "format": "uint32",
      "maximum": 1,
      "minimum": 1
    },
    "sections": {
      "$ref": "#/$defs/Sections"
    },
    "timestamps": {
      "$ref": "#/$defs/Timestamps"
    },
    "title": {
      "type": "string"
    }
  },
  "additionalProperties": false,
  "required": [
    "schemaVersion",
    "noteId",
    "title",
    "sections",
    "organization",
    "timestamps"
  ],
  "$defs": {
    "Block": {
      "description": "A block in one of the Cornell note sections.",
      "oneOf": [
        {
          "type": "object",
          "properties": {
            "children": {
              "type": "array",
              "items": {
                "$ref": "#/$defs/Inline"
              }
            },
            "type": {
              "type": "string",
              "const": "paragraph"
            }
          },
          "additionalProperties": false,
          "required": [
            "type",
            "children"
          ]
        },
        {
          "type": "object",
          "properties": {
            "children": {
              "type": "array",
              "items": {
                "$ref": "#/$defs/Inline"
              }
            },
            "type": {
              "type": "string",
              "const": "heading1"
            }
          },
          "additionalProperties": false,
          "required": [
            "type",
            "children"
          ]
        },
        {
          "type": "object",
          "properties": {
            "children": {
              "type": "array",
              "items": {
                "$ref": "#/$defs/Inline"
              }
            },
            "type": {
              "type": "string",
              "const": "heading2"
            }
          },
          "additionalProperties": false,
          "required": [
            "type",
            "children"
          ]
        },
        {
          "type": "object",
          "properties": {
            "children": {
              "type": "array",
              "items": {
                "$ref": "#/$defs/Inline"
              }
            },
            "type": {
              "type": "string",
              "const": "heading3"
            }
          },
          "additionalProperties": false,
          "required": [
            "type",
            "children"
          ]
        },
        {
          "type": "object",
          "properties": {
            "items": {
              "type": "array",
              "items": {
                "$ref": "#/$defs/ListItem"
              }
            },
            "start": {
              "type": "integer",
              "format": "uint32",
              "minimum": 0
            },
            "type": {
              "type": "string",
              "const": "orderedList"
            }
          },
          "additionalProperties": false,
          "required": [
            "type",
            "start",
            "items"
          ]
        },
        {
          "type": "object",
          "properties": {
            "items": {
              "type": "array",
              "items": {
                "$ref": "#/$defs/ListItem"
              }
            },
            "type": {
              "type": "string",
              "const": "bulletList"
            }
          },
          "additionalProperties": false,
          "required": [
            "type",
            "items"
          ]
        },
        {
          "type": "object",
          "properties": {
            "items": {
              "type": "array",
              "items": {
                "$ref": "#/$defs/TaskListItem"
              }
            },
            "type": {
              "type": "string",
              "const": "taskList"
            }
          },
          "additionalProperties": false,
          "required": [
            "type",
            "items"
          ]
        },
        {
          "type": "object",
          "properties": {
            "blocks": {
              "type": "array",
              "items": {
                "$ref": "#/$defs/Block"
              }
            },
            "type": {
              "type": "string",
              "const": "blockquote"
            }
          },
          "additionalProperties": false,
          "required": [
            "type",
            "blocks"
          ]
        },
        {
          "type": "object",
          "properties": {
            "code": {
              "type": "string"
            },
            "language": {
              "anyOf": [
                {
                  "type": "string"
                },
                {
                  "type": "null"
                }
              ]
            },
            "type": {
              "type": "string",
              "const": "codeBlock"
            }
          },
          "additionalProperties": false,
          "required": [
            "type",
            "language",
            "code"
          ]
        },
        {
          "type": "object",
          "properties": {
            "type": {
              "type": "string",
              "const": "horizontalRule"
            }
          },
          "additionalProperties": false,
          "required": [
            "type"
          ]
        },
        {
          "type": "object",
          "properties": {
            "rows": {
              "type": "array",
              "items": {
                "$ref": "#/$defs/TableRow"
              }
            },
            "type": {
              "type": "string",
              "const": "table"
            }
          },
          "additionalProperties": false,
          "required": [
            "type",
            "rows"
          ]
        },
        {
          "type": "object",
          "properties": {
            "latex": {
              "type": "string"
            },
            "type": {
              "type": "string",
              "const": "mathBlock"
            }
          },
          "additionalProperties": false,
          "required": [
            "type",
            "latex"
          ]
        },
        {
          "type": "object",
          "properties": {
            "assetId": {
              "type": "string",
              "pattern": "^[0-9a-f]{8}-[0-9a-f]{4}-4[0-9a-f]{3}-[89ab][0-9a-f]{3}-[0-9a-f]{12}$"
            },
            "displayWidthPx": {
              "type": "integer",
              "format": "uint32",
              "minimum": 0
            },
            "type": {
              "type": "string",
              "const": "image"
            }
          },
          "additionalProperties": false,
          "required": [
            "type",
            "assetId",
            "displayWidthPx"
          ]
        },
        {
          "type": "object",
          "properties": {
            "mapId": {
              "type": "string",
              "pattern": "^[0-9a-f]{8}-[0-9a-f]{4}-4[0-9a-f]{3}-[89ab][0-9a-f]{3}-[0-9a-f]{12}$"
            },
            "nodes": {
              "type": "array",
              "items": {
                "$ref": "#/$defs/MindMapNode"
              },
              "maxItems": 5000
            },
            "rootId": {
              "type": "string",
              "pattern": "^[0-9a-f]{8}-[0-9a-f]{4}-4[0-9a-f]{3}-[89ab][0-9a-f]{3}-[0-9a-f]{12}$"
            },
            "type": {
              "type": "string",
              "const": "mindMap"
            }
          },
          "additionalProperties": false,
          "required": [
            "type",
            "mapId",
            "rootId",
            "nodes"
          ]
        }
      ]
    },
    "Inline": {
      "oneOf": [
        {
          "type": "object",
          "properties": {
            "marks": {
              "type": "array",
              "items": {
                "$ref": "#/$defs/Mark"
              }
            },
            "text": {
              "type": "string"
            },
            "type": {
              "type": "string",
              "const": "text"
            }
          },
          "additionalProperties": false,
          "required": [
            "type",
            "text",
            "marks"
          ]
        },
        {
          "type": "object",
          "properties": {
            "type": {
              "type": "string",
              "const": "hardBreak"
            }
          },
          "additionalProperties": false,
          "required": [
            "type"
          ]
        },
        {
          "type": "object",
          "properties": {
            "latex": {
              "type": "string"
            },
            "type": {
              "type": "string",
              "const": "mathInline"
            }
          },
          "additionalProperties": false,
          "required": [
            "type",
            "latex"
          ]
        }
      ]
    },
    "ListItem": {
      "type": "object",
      "properties": {
        "blocks": {
          "type": "array",
          "items": {
            "$ref": "#/$defs/Block"
          }
        }
      },
      "additionalProperties": false,
      "required": [
        "blocks"
      ]
    },
    "Mark": {
      "oneOf": [
        {
          "type": "object",
          "properties": {
            "type": {
              "type": "string",
              "const": "bold"
            }
          },
          "additionalProperties": false,
          "required": [
            "type"
          ]
        },
        {
          "type": "object",
          "properties": {
            "type": {
              "type": "string",
              "const": "italic"
            }
          },
          "additionalProperties": false,
          "required": [
            "type"
          ]
        },
        {
          "type": "object",
          "properties": {
            "type": {
              "type": "string",
              "const": "strike"
            }
          },
          "additionalProperties": false,
          "required": [
            "type"
          ]
        },
        {
          "type": "object",
          "properties": {
            "type": {
              "type": "string",
              "const": "code"
            }
          },
          "additionalProperties": false,
          "required": [
            "type"
          ]
        },
        {
          "type": "object",
          "properties": {
            "href": {
              "type": "string"
            },
            "type": {
              "type": "string",
              "const": "link"
            }
          },
          "additionalProperties": false,
          "required": [
            "type",
            "href"
          ]
        }
      ]
    },
    "MindMapNode": {
      "type": "object",
      "properties": {
        "children": {
          "type": "array",
          "items": {
            "type": "string"
          },
          "maxItems": 5000
        },
        "id": {
          "type": "string",
          "pattern": "^[0-9a-f]{8}-[0-9a-f]{4}-4[0-9a-f]{3}-[89ab][0-9a-f]{3}-[0-9a-f]{12}$"
        },
        "text": {
          "type": "string"
        }
      },
      "additionalProperties": false,
      "required": [
        "id",
        "text",
        "children"
      ]
    },
    "Organization": {
      "type": "object",
      "properties": {
        "notebookId": {
          "anyOf": [
            {
              "type": "string",
              "pattern": "^[0-9a-f]{8}-[0-9a-f]{4}-4[0-9a-f]{3}-[89ab][0-9a-f]{3}-[0-9a-f]{12}$"
            },
            {
              "type": "null"
            }
          ]
        },
        "pinned": {
          "type": "boolean"
        },
        "trashedAt": {
          "anyOf": [
            {
              "type": "string",
              "pattern": "^\\d{4}-\\d{2}-\\d{2}T\\d{2}:\\d{2}:\\d{2}\\.\\d{3}Z$"
            },
            {
              "type": "null"
            }
          ]
        }
      },
      "additionalProperties": false,
      "required": [
        "notebookId",
        "pinned",
        "trashedAt"
      ]
    },
    "Sections": {
      "type": "object",
      "properties": {
        "content": {
          "type": "array",
          "items": {
            "$ref": "#/$defs/Block"
          }
        },
        "cue": {
          "type": "array",
          "items": {
            "$ref": "#/$defs/Block"
          }
        },
        "summary": {
          "type": "array",
          "items": {
            "$ref": "#/$defs/Block"
          }
        }
      },
      "additionalProperties": false,
      "required": [
        "cue",
        "content",
        "summary"
      ]
    },
    "TableRow": {
      "oneOf": [
        {
          "type": "object",
          "properties": {
            "cells": {
              "type": "array",
              "items": {
                "type": "array",
                "items": {
                  "$ref": "#/$defs/Inline"
                }
              }
            },
            "type": {
              "type": "string",
              "const": "header"
            }
          },
          "additionalProperties": false,
          "required": [
            "type",
            "cells"
          ]
        },
        {
          "type": "object",
          "properties": {
            "cells": {
              "type": "array",
              "items": {
                "type": "array",
                "items": {
                  "$ref": "#/$defs/Inline"
                }
              }
            },
            "type": {
              "type": "string",
              "const": "body"
            }
          },
          "additionalProperties": false,
          "required": [
            "type",
            "cells"
          ]
        }
      ]
    },
    "TaskListItem": {
      "type": "object",
      "properties": {
        "blocks": {
          "type": "array",
          "items": {
            "$ref": "#/$defs/Block"
          }
        },
        "checked": {
          "type": "boolean"
        }
      },
      "additionalProperties": false,
      "required": [
        "checked",
        "blocks"
      ]
    },
    "Timestamps": {
      "type": "object",
      "properties": {
        "contentModifiedAt": {
          "type": "string",
          "pattern": "^\\d{4}-\\d{2}-\\d{2}T\\d{2}:\\d{2}:\\d{2}\\.\\d{3}Z$"
        },
        "createdAt": {
          "type": "string",
          "pattern": "^\\d{4}-\\d{2}-\\d{2}T\\d{2}:\\d{2}:\\d{2}\\.\\d{3}Z$"
        },
        "organizationModifiedAt": {
          "type": "string",
          "pattern": "^\\d{4}-\\d{2}-\\d{2}T\\d{2}:\\d{2}:\\d{2}\\.\\d{3}Z$"
        }
      },
      "additionalProperties": false,
      "required": [
        "createdAt",
        "contentModifiedAt",
        "organizationModifiedAt"
      ]
    }
  }
}
