{"schemaVersion":1,"noteId":"aaaaaaaa-aaaa-4aaa-8aaa-aaaaaaaaaaaa","title":"Rich fixture","sections":{"cue":[{"type":"paragraph","children":[{"type":"text","text":"cue","marks":[]}]},{"type":"heading1","children":[{"type":"text","text":"Cue heading","marks":[]}]},{"type":"bulletList","items":[{"blocks":[{"type":"paragraph","children":[{"type":"text","text":"bold cue","marks":[{"type":"bold"}]},{"type":"hardBreak"},{"type":"text","text":"next line","marks":[]}]}]}]}],"content":[{"type":"paragraph","children":[{"type":"text","text":"All approved blocks","marks":[]},{"type":"hardBreak"},{"type":"mathInline","latex":"x^2"},{"type":"text","text":" link","marks":[{"type":"bold"},{"type":"italic"},{"type":"strike"},{"type":"code"},{"type":"link","href":"https://example.test/path"}]},{"type":"text","text":" email","marks":[{"type":"link","href":"mailto:notes@example.test"}]}]},{"type":"heading1","children":[{"type":"text","text":"H1","marks":[]}]},{"type":"heading2","children":[{"type":"text","text":"H2","marks":[]}]},{"type":"heading3","children":[{"type":"text","text":"H3","marks":[]}]},{"type":"orderedList","start":2,"items":[{"blocks":[{"type":"paragraph","children":[{"type":"text","text":"ordered","marks":[]}]}]}]},{"type":"bulletList","items":[{"blocks":[{"type":"paragraph","children":[{"type":"text","text":"bullet","marks":[]}]}]}]},{"type":"taskList","items":[{"checked":true,"blocks":[{"type":"paragraph","children":[{"type":"text","text":"checked task","marks":[]}]}]},{"checked":false,"blocks":[{"type":"paragraph","children":[{"type":"text","text":"unchecked task","marks":[]}]}]}]},{"type":"blockquote","blocks":[{"type":"paragraph","children":[{"type":"text","text":"quote","marks":[]}]}]},{"type":"codeBlock","language":"rust","code":"fn main() {}"},{"type":"codeBlock","language":null,"code":"plain code"},{"type":"horizontalRule"},{"type":"table","rows":[{"type":"header","cells":[[{"type":"text","text":"head A","marks":[]}],[{"type":"text","text":"head B","marks":[]}]]},{"type":"body","cells":[[{"type":"text","text":"cell A","marks":[]}],[{"type":"text","text":"cell B","marks":[]}]]}]},{"type":"mathBlock","latex":"\\frac{1}{2}"},{"type":"image","assetId":"11111111-1111-4111-8111-111111111111","displayWidthPx":320},{"type":"mindMap","mapId":"22222222-2222-4222-8222-222222222222","rootId":"33333333-3333-4333-8333-333333333333","nodes":[{"id":"33333333-3333-4333-8333-333333333333","text":"root","children":["44444444-4444-4444-8444-444444444444"]},{"id":"44444444-4444-4444-8444-444444444444","text":"child","children":[]}]}],"summary":[{"type":"heading2","children":[{"type":"text","text":"Summary","marks":[]}]},{"type":"orderedList","start":1,"items":[{"blocks":[{"type":"paragraph","children":[{"type":"text","text":"takeaway","marks":[]}]}]}]}]},"organization":{"notebookId":"bbbbbbbb-bbbb-4bbb-8bbb-bbbbbbbbbbbb","pinned":true,"trashedAt":null},"timestamps":{"createdAt":"2026-10-01T12:00:00.123Z","contentModifiedAt":"2026-10-02T12:00:00.123Z","organizationModifiedAt":"2026-10-03T12:00:00.123Z"}}
