{"schemaVersion":1,"schemaVersion":1,"noteId":"aaaaaaaa-aaaa-4aaa-8aaa-aaaaaaaaaaaa","title":"Duplicate key","sections":{"cue":[],"content":[],"summary":[]},"organization":{"notebookId":null,"pinned":false,"trashedAt":null},"timestamps":{"createdAt":"2026-10-01T12:00:00.123Z","contentModifiedAt":"2026-10-01T12:00:00.123Z","organizationModifiedAt":"2026-10-01T12:00:00.123Z"}}
